{
  "schema_version": "1.0",
  "runs": [
    {
      "run_id": "before-large-1",
      "variant_id": "large",
      "spans": 16,
      "tokens": 15950,
      "cost_usd": 0.036921999999999996,
      "task_success": true
    },
    {
      "run_id": "before-large-2",
      "variant_id": "large",
      "spans": 16,
      "tokens": 15950,
      "cost_usd": 0.036921999999999996,
      "task_success": true
    },
    {
      "run_id": "before-large-3",
      "variant_id": "large",
      "spans": 16,
      "tokens": 15950,
      "cost_usd": 0.036921999999999996,
      "task_success": true
    },
    {
      "run_id": "before-large-4",
      "variant_id": "large",
      "spans": 16,
      "tokens": 15950,
      "cost_usd": 0.036921999999999996,
      "task_success": true
    },
    {
      "run_id": "before-small-1",
      "variant_id": "small",
      "spans": 16,
      "tokens": 15950,
      "cost_usd": 0.013847,
      "task_success": true
    },
    {
      "run_id": "before-small-2",
      "variant_id": "small",
      "spans": 16,
      "tokens": 15950,
      "cost_usd": 0.013847,
      "task_success": true
    },
    {
      "run_id": "before-small-3",
      "variant_id": "small",
      "spans": 16,
      "tokens": 15950,
      "cost_usd": 0.013847,
      "task_success": true
    },
    {
      "run_id": "before-small-4",
      "variant_id": "small",
      "spans": 16,
      "tokens": 15950,
      "cost_usd": 0.013847,
      "task_success": false
    }
  ],
  "total_tokens": 127600,
  "total_cost_usd": 0.20307599999999998,
  "config": {
    "prompt_cache_min_prefix_tokens": 1000,
    "prompt_cache_min_repeats": 2,
    "prompt_cache_read_price_ratio": 0.1,
    "prompt_compression_min_input_tokens": 4000,
    "prompt_compression_min_ratio": 20.0,
    "prompt_compression_target_reduction": 0.3,
    "retrieval_min_chunks": 4,
    "retrieval_max_utility": 0.5,
    "retrieval_rerank_min_rank": 4,
    "memory_max_share": 0.4,
    "memory_token_budget": 2000,
    "tool_cache_min_repeats": 2,
    "retry_min_unrecovered": 2,
    "redundant_step_min_repeats": 2,
    "handoff_min_occurrences": 1,
    "tradeoff_min_runs": 3,
    "tradeoff_max_success_rate_drop": 0.25,
    "tradeoff_min_cost_reduction": 0.2,
    "confidence_level": 0.95,
    "high_confidence_min_runs": 3,
    "high_confidence_min_share": 0.5,
    "monthly_runs": 30000
  },
  "opportunities": [
    {
      "opportunity_id": "quality_cost_tradeoff-7ce924e57bba",
      "rule_id": "quality_cost_tradeoff",
      "rule_version": "1",
      "area": "model",
      "kind": "quality_cost_tradeoff",
      "title": "Switch from 'large' to 'small'",
      "summary": "'small' cost 62% less per run with success 75% vs 100%.",
      "action": "Trial 'small' behind advisory routing or a canary before replacing the baseline.",
      "subject": {
        "baseline_variant_id": "large",
        "variant_id": "small"
      },
      "thresholds": {
        "tradeoff_min_runs": 3,
        "tradeoff_min_cost_reduction": 0.2,
        "tradeoff_max_success_rate_drop": 0.25
      },
      "runs_observed": 8,
      "runs_affected": 8,
      "evidence": [
        {
          "run_id": "before-small-1",
          "span_ids": [],
          "measurements": {
            "variant_id": "small",
            "task_success": true,
            "cost_usd": 0.013847,
            "tokens": 15950
          },
          "reasoning": "Measured run in the compared variants."
        },
        {
          "run_id": "before-small-2",
          "span_ids": [],
          "measurements": {
            "variant_id": "small",
            "task_success": true,
            "cost_usd": 0.013847,
            "tokens": 15950
          },
          "reasoning": "Measured run in the compared variants."
        },
        {
          "run_id": "before-small-3",
          "span_ids": [],
          "measurements": {
            "variant_id": "small",
            "task_success": true,
            "cost_usd": 0.013847,
            "tokens": 15950
          },
          "reasoning": "Measured run in the compared variants."
        },
        {
          "run_id": "before-small-4",
          "span_ids": [],
          "measurements": {
            "variant_id": "small",
            "task_success": false,
            "cost_usd": 0.013847,
            "tokens": 15950
          },
          "reasoning": "Measured run in the compared variants."
        },
        {
          "run_id": "before-large-1",
          "span_ids": [],
          "measurements": {
            "variant_id": "large",
            "task_success": true,
            "cost_usd": 0.036921999999999996,
            "tokens": 15950
          },
          "reasoning": "Measured run in the compared variants."
        },
        {
          "run_id": "before-large-2",
          "span_ids": [],
          "measurements": {
            "variant_id": "large",
            "task_success": true,
            "cost_usd": 0.036921999999999996,
            "tokens": 15950
          },
          "reasoning": "Measured run in the compared variants."
        },
        {
          "run_id": "before-large-3",
          "span_ids": [],
          "measurements": {
            "variant_id": "large",
            "task_success": true,
            "cost_usd": 0.036921999999999996,
            "tokens": 15950
          },
          "reasoning": "Measured run in the compared variants."
        },
        {
          "run_id": "before-large-4",
          "span_ids": [],
          "measurements": {
            "variant_id": "large",
            "task_success": true,
            "cost_usd": 0.036921999999999996,
            "tokens": 15950
          },
          "reasoning": "Measured run in the compared variants."
        }
      ],
      "benefit": {
        "tokens_per_run": 0.0,
        "cost_usd_per_run": 0.023075,
        "latency_ms_per_run": 0.0,
        "monthly_cost_usd": 692.25,
        "cost_available": true,
        "basis": "Difference between the variants' measured mean per-run cost. Averaged over every observed run, including unaffected ones."
      },
      "confidence": "medium",
      "confidence_reasons": [
        "Observed in 8 of 8 runs (100%).",
        "Fewer than 30 runs per variant."
      ],
      "risks": [
        {
          "kind": "quality_regression",
          "severity": "medium",
          "description": "Success rate 75% vs 100% (p=0.285)."
        },
        {
          "kind": "sample_size",
          "severity": "medium",
          "description": "4 and 4 runs; small samples cannot rule out a quality drop larger than the allowed threshold."
        }
      ]
    },
    {
      "opportunity_id": "memory_summarization-4774cb4162b2",
      "rule_id": "memory",
      "rule_version": "1",
      "area": "memory",
      "kind": "memory_summarization",
      "title": "Bound memory with summarization and retention",
      "summary": "Memory reads took over 40% of tokens in 8 runs; 8 grew on every read.",
      "action": "Summarize older memory into a digest of about 2000 tokens and add a retention window, since memory grew on every read.",
      "subject": {
        "span_type": "memory_read"
      },
      "thresholds": {
        "memory_max_share": 0.4,
        "memory_token_budget": 2000
      },
      "runs_observed": 8,
      "runs_affected": 8,
      "evidence": [
        {
          "run_id": "before-large-1",
          "span_ids": [
            "before-large-1-03",
            "before-large-1-04",
            "before-large-1-05"
          ],
          "measurements": {
            "memory_tokens": 6700,
            "run_tokens": 15950,
            "memory_share": 0.4201,
            "grows_every_read": true
          },
          "reasoning": "Memory reads exceed the configured share and token budget."
        },
        {
          "run_id": "before-large-2",
          "span_ids": [
            "before-large-2-03",
            "before-large-2-04",
            "before-large-2-05"
          ],
          "measurements": {
            "memory_tokens": 6700,
            "run_tokens": 15950,
            "memory_share": 0.4201,
            "grows_every_read": true
          },
          "reasoning": "Memory reads exceed the configured share and token budget."
        },
        {
          "run_id": "before-large-3",
          "span_ids": [
            "before-large-3-03",
            "before-large-3-04",
            "before-large-3-05"
          ],
          "measurements": {
            "memory_tokens": 6700,
            "run_tokens": 15950,
            "memory_share": 0.4201,
            "grows_every_read": true
          },
          "reasoning": "Memory reads exceed the configured share and token budget."
        },
        {
          "run_id": "before-large-4",
          "span_ids": [
            "before-large-4-03",
            "before-large-4-04",
            "before-large-4-05"
          ],
          "measurements": {
            "memory_tokens": 6700,
            "run_tokens": 15950,
            "memory_share": 0.4201,
            "grows_every_read": true
          },
          "reasoning": "Memory reads exceed the configured share and token budget."
        },
        {
          "run_id": "before-small-1",
          "span_ids": [
            "before-small-1-03",
            "before-small-1-04",
            "before-small-1-05"
          ],
          "measurements": {
            "memory_tokens": 6700,
            "run_tokens": 15950,
            "memory_share": 0.4201,
            "grows_every_read": true
          },
          "reasoning": "Memory reads exceed the configured share and token budget."
        },
        {
          "run_id": "before-small-2",
          "span_ids": [
            "before-small-2-03",
            "before-small-2-04",
            "before-small-2-05"
          ],
          "measurements": {
            "memory_tokens": 6700,
            "run_tokens": 15950,
            "memory_share": 0.4201,